<?xml version="1.0" encoding="UTF-8"?>
<accounts xmlns="http://www.solms.co.za/finance/accounts"
    xmlns:xsi="http://www.w3.org/2001/XMLSchema-instance"
    xsi:schemaLocation="http://www.solms.co.za/finance/accounts ./accounts.xsd">
    
    <account xsi:type="SavingsAccount">
        <accountNumber>S111</accountNumber>
        <balance>100</balance>
        <interestRate>4.3</interestRate>
    </account>
    
    <account xsi:type="CreditCardAccount">
        <accountNumber>CC121</accountNumber>
        <balance>345</balance>
        <creditLimit>1000</creditLimit>
        <creditCard>
            <cardNumber>4444 5555 3333 2221</cardNumber>
            <clearingHouse>AllClear</clearingHouse>
            <holderName>John Smith</holderName>
            <expiryDate>2010-01-02</expiryDate>
        </creditCard>
        <creditCard>
            <cardNumber>4444 5555 3333 2222</cardNumber>
            <clearingHouse>AllClear</clearingHouse>
            <holderName>Tandi Smith</holderName>
            <expiryDate>2010-01-02</expiryDate>
        </creditCard>
    </account>
    
    <account xsi:type="SavingsAccount">
        <accountNumber>S112</accountNumber>
        <balance>15000</balance>
        <interestRate>5.1</interestRate>
    </account>
    
</accounts>